{
  "type": "brewery:machine_recipe",
  "machine": "brewery:kettle",
  "inputs": [
    { "ingredient": "brewery:wort", "amount": 1000, "role": "base" },
    { "ingredient": "#minecraft:small_flowers", "amount": 1, "role": "botanical" }
  ],
  "output": {
    "liquid": "brewery:wort",
    "amount": 1000,
    "metadata_delta": { "bitter": 1 }
  },
  "time": 200,
  "energy": 35
}
