{
  "type": "brewery:machine_recipe",
  "machine": "brewery:fermenter",
  "inputs": [
    { "ingredient": "brewery:wort", "amount": 1000, "role": "base" },
    { "ingredient": "minecraft:sugar", "amount": 1, "role": "modifier" }
  ],
  "output": {
    "liquid": "brewery:young_alcohol",
    "amount": 1000,
    "metadata_delta": { "strength": 1.0, "clarity": 0.1 }
  },
  "time": 300,
  "energy": 40
}
